{
  "$id": "https://nearmiss.dev/schema/public-fars-state-context-index.schema.json",
  "$schema": "https://json-schema.org/draft/2020-12/schema",
  "additionalProperties": false,
  "properties": {
    "artifact_type": {
      "const": "nearmiss.public.fars_state_context_index"
    },
    "contract": {
      "const": {
        "algorithm_version": "state-involved-mode-v1",
        "artifact_schema_version": "1.0.0",
        "artifact_type": "nearmiss.public.fars_state_context",
        "contribution_unit": "distinct_crash_once_per_involved_mode",
        "dimension": "involved_mode",
        "effective_k": 10,
        "modes": [
          "motor_vehicle_occupant",
          "motorcyclist",
          "pedalcyclist",
          "pedestrian",
          "other_road_user",
          "unknown"
        ],
        "modes_non_additive": true,
        "state_count": 51
      }
    },
    "default_year": {
      "enum": [
        2020,
        2021,
        2022,
        2023,
        2024
      ],
      "type": "integer"
    },
    "releases": {
      "items": {
        "$ref": "#/$defs/release"
      },
      "maxItems": 5,
      "minItems": 1,
      "type": "array"
    },
    "schema_version": {
      "const": "1.0.0"
    },
    "visibility": {
      "const": "public"
    }
  },
  "required": [
    "artifact_type",
    "contract",
    "default_year",
    "releases",
    "schema_version",
    "visibility"
  ],
  "title": "Public NearMiss annual FARS state-context release index",
  "type": "object",
  "$defs": {
    "annualContract": {
      "additionalProperties": false,
      "properties": {
        "contract_revision": {
          "minimum": 1,
          "type": "integer"
        },
        "contract_sha256": {
          "pattern": "^[0-9a-f]{64}$",
          "type": "string"
        },
        "crash_mapping_version": {
          "pattern": "^[0-9]+\\.[0-9]+\\.[0-9]+$",
          "type": "string"
        },
        "person_mapping_version": {
          "pattern": "^[0-9]+\\.[0-9]+\\.[0-9]+$",
          "type": "string"
        },
        "semantic_regime_id": {
          "minLength": 1,
          "type": "string"
        },
        "state_code_system": {
          "pattern": "^nhtsa_fars_state_20(20|21|22|23|24)$",
          "type": "string"
        }
      },
      "required": [
        "contract_revision",
        "contract_sha256",
        "crash_mapping_version",
        "person_mapping_version",
        "semantic_regime_id",
        "state_code_system"
      ],
      "type": "object"
    },
    "geography": {
      "additionalProperties": false,
      "properties": {
        "coverage": {
          "pattern": "^official_20(20|21|22|23|24)_national_50_states_and_dc$",
          "type": "string"
        },
        "state_crosswalk_sha256": {
          "pattern": "^[0-9a-f]{64}$",
          "type": "string"
        },
        "state_crosswalk_version": {
          "pattern": "^fars-usps-50-states-dc-20(20|21|22|23|24)-v1$",
          "type": "string"
        }
      },
      "required": [
        "coverage",
        "state_crosswalk_sha256",
        "state_crosswalk_version"
      ],
      "type": "object"
    },
    "release": {
      "additionalProperties": false,
      "allOf": [
        {
          "oneOf": [
            {
              "$ref": "#/$defs/year2020"
            },
            {
              "$ref": "#/$defs/year2021"
            },
            {
              "$ref": "#/$defs/year2022"
            },
            {
              "$ref": "#/$defs/year2023"
            },
            {
              "$ref": "#/$defs/year2024"
            }
          ]
        }
      ],
      "properties": {
        "artifact_bytes": {
          "maximum": 262144,
          "minimum": 1,
          "type": "integer"
        },
        "artifact_path": {
          "pattern": "^fars-20(20|21|22|23|24)-state-mode\\.json$",
          "type": "string"
        },
        "artifact_sha256": {
          "pattern": "^[0-9a-f]{64}$",
          "type": "string"
        },
        "contract": {
          "$ref": "#/$defs/annualContract"
        },
        "dataset_year": {
          "enum": [
            2020,
            2021,
            2022,
            2023,
            2024
          ],
          "type": "integer"
        },
        "geography": {
          "$ref": "#/$defs/geography"
        },
        "source": {
          "$ref": "#/$defs/source"
        }
      },
      "required": [
        "artifact_bytes",
        "artifact_path",
        "artifact_sha256",
        "contract",
        "dataset_year",
        "geography",
        "source"
      ],
      "type": "object"
    },
    "source": {
      "additionalProperties": false,
      "properties": {
        "distribution_url": {
          "format": "uri",
          "type": "string"
        },
        "raw_sha256": {
          "pattern": "^[0-9a-f]{64}$",
          "type": "string"
        },
        "raw_size_bytes": {
          "maximum": 268435456,
          "minimum": 1,
          "type": "integer"
        },
        "source_revision_id": {
          "pattern": "^reviewed-[0-9]{8}-[0-9a-f]{12}$",
          "type": "string"
        }
      },
      "required": [
        "distribution_url",
        "raw_sha256",
        "raw_size_bytes",
        "source_revision_id"
      ],
      "type": "object"
    },
    "year2020": {
      "properties": {
        "artifact_path": {
          "const": "fars-2020-state-mode.json"
        },
        "contract": {
          "const": {
            "contract_revision": 1,
            "contract_sha256": "c6294413066bb2e83b2aea02408dcfa2fa40441dda7de115983a45fb8aab132c",
            "crash_mapping_version": "1.0.0",
            "person_mapping_version": "1.0.0",
            "semantic_regime_id": "fars_per_typ_2020_2021_v1",
            "state_code_system": "nhtsa_fars_state_2020"
          }
        },
        "dataset_year": {
          "const": 2020
        },
        "geography": {
          "properties": {
            "coverage": {
              "const": "official_2020_national_50_states_and_dc"
            },
            "state_crosswalk_sha256": {
              "const": "a96bc1c2c9623f5485a6739009fb0a21855c0fb5ae7d2e2d5dd4b1bb21231be4"
            },
            "state_crosswalk_version": {
              "const": "fars-usps-50-states-dc-2020-v1"
            }
          }
        },
        "source": {
          "const": {
            "distribution_url": "https://static.nhtsa.gov/nhtsa/downloads/FARS/2020/National/FARS2020NationalCSV.zip",
            "raw_sha256": "b2806902b3da9b45c632499f82e1c74fd108238ae7f67e108ebf40360ee4c9c3",
            "raw_size_bytes": 31016385,
            "source_revision_id": "reviewed-20260712-b2806902b3da"
          }
        }
      }
    },
    "year2021": {
      "properties": {
        "artifact_path": {
          "const": "fars-2021-state-mode.json"
        },
        "contract": {
          "const": {
            "contract_revision": 1,
            "contract_sha256": "5c2c198cd4e3eee80f9e27874e3f42521b0e0b7cbc53a8bd0bf2684ef66a855e",
            "crash_mapping_version": "1.0.0",
            "person_mapping_version": "1.0.0",
            "semantic_regime_id": "fars_per_typ_2020_2021_v1",
            "state_code_system": "nhtsa_fars_state_2021"
          }
        },
        "dataset_year": {
          "const": 2021
        },
        "geography": {
          "properties": {
            "coverage": {
              "const": "official_2021_national_50_states_and_dc"
            },
            "state_crosswalk_sha256": {
              "const": "acf98a21f7358fbeee6bc2bc1c07eaea8e375fb1dd869624568bb5bef6dc0dac"
            },
            "state_crosswalk_version": {
              "const": "fars-usps-50-states-dc-2021-v1"
            }
          }
        },
        "source": {
          "const": {
            "distribution_url": "https://static.nhtsa.gov/nhtsa/downloads/FARS/2021/National/FARS2021NationalCSV.zip",
            "raw_sha256": "743c19a13884614430d295289e655c5ad32b0a025a11e5b2149dfb57acae389b",
            "raw_size_bytes": 35190858,
            "source_revision_id": "reviewed-20260712-743c19a13884"
          }
        }
      }
    },
    "year2022": {
      "properties": {
        "artifact_path": {
          "const": "fars-2022-state-mode.json"
        },
        "contract": {
          "const": {
            "contract_revision": 1,
            "contract_sha256": "18713f23f657334459febf729e4005bfd9e94492da37afb0255d9e5fd4159158",
            "crash_mapping_version": "1.0.0",
            "person_mapping_version": "1.0.0",
            "semantic_regime_id": "fars_per_typ_2022_2024_v1",
            "state_code_system": "nhtsa_fars_state_2022"
          }
        },
        "dataset_year": {
          "const": 2022
        },
        "geography": {
          "properties": {
            "coverage": {
              "const": "official_2022_national_50_states_and_dc"
            },
            "state_crosswalk_sha256": {
              "const": "3fda2696337c5f8263947ecc5b748b354f751178320796cec135e006d3bf9be5"
            },
            "state_crosswalk_version": {
              "const": "fars-usps-50-states-dc-2022-v1"
            }
          }
        },
        "source": {
          "const": {
            "distribution_url": "https://static.nhtsa.gov/nhtsa/downloads/FARS/2022/National/FARS2022NationalCSV.zip",
            "raw_sha256": "989448d7a2f3964264c96a3cdb220f6c413c782a33eb759781f520c5acb5f744",
            "raw_size_bytes": 34689724,
            "source_revision_id": "reviewed-20260712-989448d7a2f3"
          }
        }
      }
    },
    "year2023": {
      "properties": {
        "artifact_path": {
          "const": "fars-2023-state-mode.json"
        },
        "contract": {
          "const": {
            "contract_revision": 1,
            "contract_sha256": "557a8edf2418c7794d349c932ae2237db6cad7165f62c80a2e7f3b15baeca143",
            "crash_mapping_version": "1.0.0",
            "person_mapping_version": "1.0.0",
            "semantic_regime_id": "fars_per_typ_2022_2024_v1",
            "state_code_system": "nhtsa_fars_state_2023"
          }
        },
        "dataset_year": {
          "const": 2023
        },
        "geography": {
          "properties": {
            "coverage": {
              "const": "official_2023_national_50_states_and_dc"
            },
            "state_crosswalk_sha256": {
              "const": "a1eae08dba21b0a4b20fa797370529475796a344d828856e5048488ae333d944"
            },
            "state_crosswalk_version": {
              "const": "fars-usps-50-states-dc-2023-v1"
            }
          }
        },
        "source": {
          "const": {
            "distribution_url": "https://static.nhtsa.gov/nhtsa/downloads/FARS/2023/National/FARS2023NationalCSV.zip",
            "raw_sha256": "edde841eb493e55751961b36bac2d1ce8750f601cb8e6e183a525723bb62bab0",
            "raw_size_bytes": 34174899,
            "source_revision_id": "reviewed-20260712-edde841eb493"
          }
        }
      }
    },
    "year2024": {
      "properties": {
        "artifact_path": {
          "const": "fars-2024-state-mode.json"
        },
        "contract": {
          "const": {
            "contract_revision": 1,
            "contract_sha256": "f6bc3dd55cf3dfb360c265308c7702cdf7f6df66894cf792afd6be83c09c72f8",
            "crash_mapping_version": "1.0.0",
            "person_mapping_version": "1.0.0",
            "semantic_regime_id": "fars_per_typ_2022_2024_v1",
            "state_code_system": "nhtsa_fars_state_2024"
          }
        },
        "dataset_year": {
          "const": 2024
        },
        "geography": {
          "properties": {
            "coverage": {
              "const": "official_2024_national_50_states_and_dc"
            },
            "state_crosswalk_sha256": {
              "const": "6744b12717b0bd52a79c73aba3037286dde9257698a2aa0630f995c8a82ba25c"
            },
            "state_crosswalk_version": {
              "const": "fars-usps-50-states-dc-2024-v1"
            }
          }
        },
        "source": {
          "const": {
            "distribution_url": "https://static.nhtsa.gov/nhtsa/downloads/FARS/2024/National/FARS2024NationalCSV.zip",
            "raw_sha256": "5112727a8c0dc91ffee27ca05bddb073934f2d192ce4fae997da767dccdbe04f",
            "raw_size_bytes": 32672161,
            "source_revision_id": "reviewed-20260712-5112727a8c0d"
          }
        }
      }
    }
  }
}
